{
  "$schema": "https://json-schema.org/draft/2020-12/schema",
  "$id": "https://hyperflux.dev/schemas/openrazer-native-transform-v1.json",
  "title": "Source-bound OpenRazer native transport transformation",
  "type": "object",
  "additionalProperties": false,
  "required": ["$schema", "schema", "upstream", "patch", "files"],
  "properties": {
    "$schema": {"const": "../../../schemas/openrazer-native-transform.schema.json"},
    "schema": {"const": "hyperflux-openrazer-native-transform-v1"},
    "upstream": {
      "type": "object",
      "additionalProperties": false,
      "required": ["id", "repository", "commit"],
      "properties": {
        "id": {"const": "openrazer"},
        "repository": {"const": "https://github.com/openrazer/openrazer.git"},
        "commit": {"type": "string", "pattern": "^[0-9a-f]{40}$"}
      }
    },
    "patch": {
      "type": "object",
      "additionalProperties": false,
      "required": ["path", "sha256"],
      "properties": {
        "path": {"type": "string", "pattern": "^patches/[A-Za-z0-9._-]+\\.patch$"},
        "sha256": {"type": "string", "pattern": "^[0-9a-f]{64}$"}
      }
    },
    "files": {
      "type": "array",
      "minItems": 1,
      "maxItems": 32,
      "items": {
        "type": "object",
        "additionalProperties": false,
        "required": ["path", "source_sha256", "transformed_sha256"],
        "properties": {
          "path": {
            "type": "string",
            "pattern": "^(driver/[A-Za-z0-9._-]+|install_files/udev/(99-razer\\.rules|razer_mount))$"
          },
          "source_sha256": {"type": "string", "pattern": "^[0-9a-f]{64}$"},
          "transformed_sha256": {"type": "string", "pattern": "^[0-9a-f]{64}$"}
        }
      }
    }
  }
}
